{
  "schema_version": 1,
  "id": "analytic-1",
  "workspace_id": "workspace-fixture",
  "case_id": "case-fixture",
  "revision_id": "revision-1",
  "hypothesis_id": "hyp-mobile-handler",
  "kind": "mix_shift",
  "metric_hash": "25e88e0d2448f070ea12b1afb686989a5f00133ff2fdcbe65f838492bcc508ca",
  "snapshot_hash": "b7b74494ec2dce465235f90dee685bc18212591b2fb13e521722d2435f927d35",
  "evidence_ids": [
    "evidence-1"
  ],
  "cohorts": [
    "mobile",
    "desktop"
  ],
  "expected_direction": "decrease",
  "minimum_denominator": 30,
  "purpose": "Check whether composition alone explains the aggregate decline."
}
